{
  "$schema": "../../_schema.json",
  "id": "pickle_stand",
  "display_name_key": "STALL_PICKLE_STAND_NAME",
  "description_key": "STALL_PICKLE_STAND_DESC",
  "rarity": "common",

  "card_type": "stall",
  "hero_id": "",

  "operation_model": "product",
  "need_type": "food",

  "tiers": [
	{
	  "tier": 1,
	  "cost_to_guest": 0,
	  "value": 1,
	  "restock_amount": 2,
	  "restock_duration": 2,
	  "skills": [
		{ "skill_id": "pickle_stand_summon_kappa" }
	  ]
	},
	{
	  "tier": 2,
	  "cost_to_guest": 0,
	  "value": 1,
	  "restock_amount": 3,
	  "restock_duration": 2,
	  "skills": [
		{ "skill_id": "pickle_stand_summon_kappa" }
	  ]
	},
	{
	  "tier": 3,
	  "cost_to_guest": 0,
	  "value": 1,
	  "restock_amount": 4,
	  "restock_duration": 2,
	  "skills": [
		{ "skill_id": "pickle_stand_summon_kappa" }
	  ]
	}
  ],

  "placement_restriction": null,

  "tags": []
}
