{
  "$schema": "./_schema.json",
  "id": "fish_spa",
  "display_name_key": "STALL_FISH_SPA_NAME",
  "description_key": "STALL_FISH_SPA_DESC",
  "rarity": "common",
  "icon_path": "",
  "sprite_sheet": "",

  "card_type": "stall",
  "hero_id": "",

  "operation_model": "service",
  "need_type": "joy",

  "tiers": [
    {
      "tier": 1,
      "cost_to_guest": 2,
      "value": 2,
      "service_duration": 3,
      "capacity": 2,
      "skills": [
        { "skill_id": "fish_spa_cleanse" }
      ]
    },
    {
      "tier": 2,
      "cost_to_guest": 2,
      "value": 2,
      "service_duration": 2,
      "capacity": 2,
      "skills": [
        { "skill_id": "fish_spa_cleanse" }
      ]
    },
    {
      "tier": 3,
      "cost_to_guest": 2,
      "value": 2,
      "service_duration": 1,
      "capacity": 2,
      "skills": [
        { "skill_id": "fish_spa_cleanse" }
      ]
    }
  ],

  "placement_restriction": null,

  "tags": ["joy_stall", "service"]
}
