{
  "$schema": "./_schema.json",
  "id": "stone_stacking",
  "display_name_key": "STALL_STONE_STACKING_NAME",
  "description_key": "STALL_STONE_STACKING_DESC",
  "rarity": "common",

  "card_type": "stall",
  "hero_id": "",
  "shopable": false,

  "operation_model": "service",
  "need_type": "joy",

  "tiers": [
	{
	  "tier": 1,
	  "cost_to_guest": 0,
	  "value": 2,
	  "service_duration": 3,
	  "capacity": 1
	},
	{
	  "tier": 2,
	  "cost_to_guest": 0,
	  "value": 2,
	  "service_duration": 2,
	  "capacity": 1
	},
	{
	  "tier": 3,
	  "cost_to_guest": 0,
	  "value": 2,
	  "service_duration": 1,
	  "capacity": 1
	}
  ],

  "placement_restriction": null,
  "tags": []
}
