{
  "$schema": "../../_schema.json",
  "id": "blacksmith",
  "display_name_key": "STALL_BLACKSMITH_NAME",
  "description_key": "STALL_BLACKSMITH_DESC",
  "rarity": "rare",

  "card_type": "stall",
  "hero_id": "",

  "operation_model": "service",
  "need_type": "joy",

  "tiers": [
    {
      "tier": 1,
      "cost_to_guest": 2,
      "value": 2,
      "service_duration": 3,
      "capacity": 1,
      "skills": [
        { "skill_id": "blacksmith_status_immunity" }
      ]
    },
    {
      "tier": 2,
      "cost_to_guest": 2,
      "value": 2,
      "service_duration": 3,
      "capacity": 2,
      "skills": [
        { "skill_id": "blacksmith_status_immunity" }
      ]
    },
    {
      "tier": 3,
      "cost_to_guest": 2,
      "value": 2,
      "service_duration": 3,
      "capacity": 3,
      "skills": [
        { "skill_id": "blacksmith_status_immunity" }
      ]
    }
  ],

  "placement_restriction": null,

  "tags": []
}
