{
  "$schema": "../../_schema.json",
  "id": "warm_water",
  "display_name_key": "STALL_WARM_WATER_NAME",
  "description_key": "STALL_WARM_WATER_DESC",
  "rarity": "common",

  "card_type": "stall",
  "hero_id": "",
  "shopable": false,

  "operation_model": "product",
  "need_type": "food",

  "tiers": [
	{
	  "tier": 1,
	  "cost_to_guest": 0,
	  "value": 1,
	  "restock_amount": 2,
	  "restock_duration": 2
	},
	{
	  "tier": 2,
	  "cost_to_guest": 0,
	  "value": 1,
	  "restock_amount": 3,
	  "restock_duration": 2
	},
	{
	  "tier": 3,
	  "cost_to_guest": 0,
	  "value": 1,
	  "restock_amount": 4,
	  "restock_duration": 2
	}
  ],

  "placement_restriction": null,
  "tags": []
}
