{
  "$schema": "./_schema.json",
  "id": "candy_nuts_stand",
  "display_name_key": "STALL_CANDY_NUTS_STAND_NAME",
  "description_key": "STALL_CANDY_NUTS_STAND_DESC",
  "rarity": "rare",

  "card_type": "stall",
  "hero_id": "",

  "operation_model": "product",
  "need_type": "food",

  "tiers": [
    {
      "tier": 1,
      "cost_to_guest": 3,
      "value": 1,
      "restock_amount": 2,
      "restock_duration": 3,
      "skills": [
        { "skill_id": "candy_nuts_food_finisher" }
      ]
    },
    {
      "tier": 2,
      "cost_to_guest": 3,
      "value": 1,
      "restock_amount": 2,
      "restock_duration": 2,
      "skills": [
        { "skill_id": "candy_nuts_food_finisher" }
      ]
    },
    {
      "tier": 3,
      "cost_to_guest": 3,
      "value": 1,
      "restock_amount": 2,
      "restock_duration": 1,
      "skills": [
        { "skill_id": "candy_nuts_food_finisher" }
      ]
    }
  ],

  "placement_restriction": null,
  "tags": []
}
