{
  "$schema": "../../_schema.json",
  "id": "spirit_hall",
  "display_name_key": "STALL_SPIRIT_HALL_NAME",
  "description_key": "STALL_SPIRIT_HALL_DESC",
  "rarity": "epic",
  "icon_path": "res://assets/sprites/stalls/spirit_hall_icon.png",
  "sprite_sheet": "res://assets/sprites/stalls/spirit_hall.png",

  "card_type": "stall",
  "hero_id": "",

  "operation_model": "service",
  "need_type": "joy",

  "tiers": [
    {
      "tier": 1,
      "cost_to_guest": 1,
      "value": 1,
      "service_duration": 2,
      "capacity": 3,
      "skills": [
        { "skill_id": "spirit_hall_apply_attuned" }
      ]
    },
    {
      "tier": 2,
      "cost_to_guest": 1,
      "value": 2,
      "service_duration": 2,
      "capacity": 3,
      "skills": [
        { "skill_id": "spirit_hall_apply_attuned" }
      ]
    },
    {
      "tier": 3,
      "cost_to_guest": 1,
      "value": 3,
      "service_duration": 2,
      "capacity": 3,
      "skills": [
        { "skill_id": "spirit_hall_apply_attuned" }
      ]
    }
  ],

  "placement_restriction": null,

  "animations": {
    "idle": { "frames": [0], "fps": 1, "loop": true },
    "serving": { "frames": [1, 2, 3, 4], "fps": 8, "loop": true },
    "empty": { "frames": [5], "fps": 1, "loop": true },
    "upgrade": { "frames": [6, 7, 8], "fps": 10, "loop": false }
  },

  "tags": []
}
