{
  "$schema": "./_schema.json",
  "id": "ancient_theatre",
  "display_name_key": "STALL_ANCIENT_THEATRE_NAME",
  "description_key": "STALL_ANCIENT_THEATRE_DESC",
  "rarity": "rare",

  "card_type": "stall",
  "hero_id": "",

  "operation_model": "service",
  "need_type": "joy",

  "tiers": [
    {
      "tier": 1,
      "cost_to_guest": 1,
      "value": 2,
      "service_duration": 3,
      "capacity": 1,
      "skills": [
        { "skill_id": "ancient_theatre_apply_spooked", "parameters": { "stacks": 4 } }
      ]
    },
    {
      "tier": 2,
      "cost_to_guest": 1,
      "value": 2,
      "service_duration": 3,
      "capacity": 2,
      "skills": [
        { "skill_id": "ancient_theatre_apply_spooked", "parameters": { "stacks": 4 } }
      ]
    },
    {
      "tier": 3,
      "cost_to_guest": 1,
      "value": 2,
      "service_duration": 3,
      "capacity": 3,
      "skills": [
        { "skill_id": "ancient_theatre_apply_spooked", "parameters": { "stacks": 4 } }
      ]
    }
  ],

  "placement_restriction": null,
  "tags": []
}
