{
  "$schema": "../../_schema.json",
  "id": "moon_shrine",
  "display_name_key": "STALL_MOON_SHRINE_NAME",
  "description_key": "STALL_MOON_SHRINE_DESC",
  "rarity": "epic",

  "card_type": "stall",
  "hero_id": "",

  "operation_model": "service",
  "need_type": "joy",

  "tiers": [
    {
      "tier": 1,
      "cost_to_guest": 0,
      "value": 1,
      "service_duration": 2,
      "capacity": 1,
      "skills": [
        { "skill_id": "moon_shrine_aura", "parameters": { "status_effect_id": "moonlit_1" } }
      ]
    },
    {
      "tier": 2,
      "cost_to_guest": 0,
      "value": 1,
      "service_duration": 2,
      "capacity": 1,
      "skills": [
        { "skill_id": "moon_shrine_aura", "parameters": { "status_effect_id": "moonlit_2" } }
      ]
    },
    {
      "tier": 3,
      "cost_to_guest": 0,
      "value": 1,
      "service_duration": 2,
      "capacity": 1,
      "skills": [
        { "skill_id": "moon_shrine_aura", "parameters": { "status_effect_id": "moonlit_3" } }
      ]
    }
  ],

  "placement_restriction": null,
  "tags": ["midnight", "aura"]
}
